{
  "supplier_id": "ACME-T1-0042",
  "supplier_name": "Acme Precision Manufacturing Pte Ltd",
  "supplier_tier": "T1",
  "submitted_at": "2026-03-15T09:00:00Z",
  "country": "Singapore",
  "iso_country": "SG",
  "sites": [
    {
      "site_id": "ACME-SG-01",
      "country": "SG",
      "lat": 1.3521,
      "lon": 103.8198,
      "h3_index": "8a4f9b1e2003fff",
      "primary_activity": "Precision-machined components"
    }
  ],
  "ultimate_beneficial_owners": [
    {"name": "Lim Wei Ming",  "country": "SG", "ownership_pct": 55.0, "is_pep": false, "is_nominee": false},
    {"name": "Tan Mei Ling",  "country": "SG", "ownership_pct": 30.0, "is_pep": false, "is_nominee": false},
    {"name": "ESOP Trust",    "country": "SG", "ownership_pct": 15.0, "is_pep": false, "is_nominee": false}
  ],
  "sectors": ["electronics", "precision-machining"],
  "policies": {
    "code_of_conduct":  "Acme adopts the lead company's code of conduct and ETI Base Code. All workers are recruited locally; no fees; passports remain with the worker at all times. Hours: 44/week; overtime is voluntary and capped at 12/week.",
    "anti_bribery":     "ISO 37001:2016 certified (cert # AB-37001-SG-2024-1182). Annual training; gifts > SGD 50 require approval. Facilitation payments are prohibited.",
    "whistleblower":    "EthicsPoint channel operated by Navex; independent of supplier management; reports go directly to the lead company's audit committee. 12 reports in 2025, P50 resolution 18 days.",
    "human_rights":     "ILO C29/87/98/100/105/111/138/182 adopted.",
    "environment":      "ISO 14001 certified. ESRS E1-E5 disclosed annually.",
    "climate_transition": "SBTi-validated 1.5°C-aligned target: -42% Scope 1+2 by 2030. Scope 3 cat. 1+11+15 measured.",
    "deforestation_due_diligence": "N/A — supplier does not handle EUDR commodities."
  },
  "self_assessment_answers": {
    "age_verification_policy": "ID check on hire; quarterly audit of dorms by independent auditor",
    "wage_data_by_role":        "Median operator wage SGD 2,400/month (vs Anker living wage SGD 1,950); 100% above benchmark",
    "union_or_council":         "Independent worker council (elected; not management-appointed)"
  },
  "grievance_summary": {
    "channel_ref":           "ethicspoint://acme-precision-sg",
    "independence_attestation_ref": "doc://acme/independence-2025.pdf",
    "reports_received_yoy":  12,
    "resolution_time_p50_days": 18,
    "sample_transcripts_redacted": [
      "[REDACTED:PERSON] reported [REDACTED:DATE] that the line manager required overtime on a saturday. Resolved: HR confirmed overtime was voluntary; manager warned; policy retrained.",
      "[REDACTED:PERSON] reported dorm hot water unreliable. Resolved: boiler repaired within 5 days."
    ]
  },
  "audit_reports": [
    {
      "audit_id": "SMETA-2025-Q4-ACME-SG-01",
      "auditor":  "SGS Singapore",
      "scheme":   "SMETA",
      "date":     "2025-11-12",
      "findings": [
        {"id": "obs-01", "severity": "low", "description": "Fire-drill log gap in May 2025; corrected; closed."}
      ]
    }
  ],
  "ghg_inventory": {
    "scope_1_tco2e": 412,
    "scope_2_tco2e": 1208,
    "scope_2_method": "market-based",
    "scope_3_by_category": {"1": 4520, "2": null, "3": 88, "4": 122, "11": 6210, "15": 0},
    "boundary": "operational control, all sites in SG",
    "transition_plan_ref": "doc://acme/transition-plan-2025.pdf"
  },
  "worker_representation": {
    "union_presence": false,
    "worker_council": true,
    "cba_coverage_pct": 0
  },
  "lead_company_code_of_conduct_ref": "knowledge-pack/lead-company-code-stub"
}
